question,answers,category
HR keeps overriding my team decisions without understanding operational needs. How is this acceptable?,We understand the concern. Please raise this through CogniAssist under HR for structured discussion. HR will coordinate with leadership to align policy compliance with operational requirements.,HR
HR rejected my performance ratings and asked me to revise them without justification. This is frustrating.,Please submit the concern through CogniAssist with supporting details. HR will review the evaluation criteria and provide clarification or mediation.,HR
"I approved overtime for my team, but HR refused to process it. This is causing serious friction.",We regret the inconvenience. Please raise this through CogniAssist under HR so overtime policy alignment and approvals can be reviewed.,HR
HR is questioning my hiring decision and delaying onboarding. This is impacting delivery timelines.,Please report the issue through CogniAssist under HR. HR will review hiring compliance and coordinate to avoid unnecessary delays.,HR
HR is bypassing me and directly contacting my team members. This undermines my authority.,We understand your concern. Please submit this issue through CogniAssist under HR so communication protocols can be reviewed and corrected if needed.,HR
My leave approvals are being overridden by HR without discussion. This is not acceptable.,Please raise this concern through CogniAssist. HR will review leave governance policies and work toward resolution.,HR
HR insists on disciplinary action without understanding project pressures. This feels unfair.,We acknowledge your concern. Please submit details through CogniAssist so HR can reassess the situation with full context.,HR
"HR delayed a critical role offer citing policy issues, but no alternatives were suggested.",Please submit the concern through CogniAssist. HR will clarify constraints and propose compliant alternatives.,HR
I was not consulted before HR escalated an issue from my team to senior management.,We understand the concern. Please raise this through CogniAssist so escalation protocols can be reviewed.,HR
HR keeps sending compliance reminders that disrupt my team’s work.,Please report the issue through CogniAssist. HR will review communication frequency and ensure minimal disruption.,HR
HR rejected my promotion recommendation without explaining the criteria used.,Please submit this through CogniAssist. HR will provide clarity on promotion standards and review the recommendation.,HR
I feel HR policies are slowing down urgent project execution.,Please raise this concern through CogniAssist. HR will assess policy flexibility within compliance limits.,HR
HR asked me to justify workload decisions repeatedly. This feels like micromanagement.,We understand the frustration. Please submit the concern through CogniAssist for HR-led discussion and alignment.,HR
My team morale is affected due to conflicting messages from HR and management.,Please raise this issue through CogniAssist. HR will work with leadership to align messaging and improve team morale.,HR
HR denied remote work exceptions I approved for my team.,Please submit this concern through CogniAssist. HR will review remote work guidelines and discuss exceptions if applicable.,HR
I believe HR is applying policies inconsistently across teams.,Please report this through CogniAssist. HR will review policy application to ensure fairness and consistency.,HR
HR escalated a minor issue without consulting me first.,We understand your concern. Please raise it through CogniAssist so escalation thresholds can be reviewed.,HR
My authority as a manager feels undermined by repeated HR interventions.,Please submit this feedback through CogniAssist. HR will review governance boundaries and leadership coordination.,HR
"HR is delaying exit formalities for a departing team member, affecting knowledge transfer.",Please raise this issue through CogniAssist. HR will prioritize offboarding coordination to minimize impact.,HR
I need HR to support decisions faster instead of blocking progress.,Please submit the concern through CogniAssist so HR can review turnaround times and improve collaboration.,HR
