question,answers,category
I am extremely frustrated. My laptop has been broken for two days and nobody from IT is responding. How am I supposed to work like this?,We understand your frustration. Please raise a Critical priority ticket through CogniAssist immediately using any available device. IT will escalate the issue and ensure urgent resolution as per SLA.,IT
This is unacceptable. My salary is delayed again and no one is giving me a clear answer. Who is responsible for this mess?,We regret the inconvenience. Please submit a High priority payroll issue through CogniAssist with details. Finance and HR will investigate and respond urgently.,Finance
I am furious. I reported a phishing email and still haven’t heard back. What if my account is already compromised?,Your concern is valid. Please raise a Critical Security incident through CogniAssist immediately. IT Security will prioritize the investigation and take protective actions.,Security
I am done waiting. My manager keeps ignoring my leave request and now I don’t know what to do. This is stressing me out.,We’re sorry for the distress caused. Please submit a High priority request through CogniAssist under HR. HR will assist with escalation and resolution.,HR
This system is a joke. I’ve been locked out of all tools and no one is helping me. Do you expect me to just sit idle?,We apologize for the disruption. Please raise a Critical IT access issue through CogniAssist. IT will restore access after verification as quickly as possible.,IT
I am really angry right now. I lost my company laptop and I’m scared I’ll be blamed instead of helped.,We understand your concern. Report the incident immediately through CogniAssist as High or Critical priority. Asset Management and IT Security will guide you on next steps.,Security
My performance review was completely unfair and biased. This has seriously demotivated me.,We’re sorry to hear this. Please raise a grievance through CogniAssist under HR. HR will review the matter confidentially and follow the grievance process.,HR
I can’t take this anymore. My expenses keep getting rejected without explanation and the deadline has passed.,We understand your frustration. Please submit a High priority expense issue through CogniAssist. Finance will review and clarify the rejection promptly.,Finance
I am angry and worried. Someone is asking me to share my login password. This feels completely unsafe.,You are right to be concerned. Do not share your credentials. Report this immediately through CogniAssist under Security. IT Security will handle the situation.,Security
This is ridiculous. My VPN connects but nothing works. I’ve wasted hours trying to fix this myself.,We regret the inconvenience. Please raise a High priority IT issue through CogniAssist with screenshots. IT will diagnose and resolve the issue.,IT
I feel unsafe at work after what happened today. No one seems to care and I don’t know who to contact.,Your safety is important. Please raise a Critical HR or Safety issue through CogniAssist immediately. HR and management will take appropriate action.,HR
I am extremely upset. My personal information is visible to others and this is a serious privacy issue.,We take data privacy seriously. Please report this immediately through CogniAssist as a Critical Data Protection issue. The matter will be investigated urgently.,Security
I’m fed up. I keep getting assigned work that is clearly not part of my role. This is unfair.,We understand your concern. Please raise this through CogniAssist under HR. HR will review role expectations and coordinate with management.,HR
No one informed me about an important company policy change and now I’m being questioned for it. How is this fair?,We’re sorry for the confusion. Please raise the concern through CogniAssist so HR can clarify the policy communication and provide guidance.,Company
I am panicking. I need urgent travel approval and my trip is tomorrow. Nobody is responding.,Please submit a Critical priority request through CogniAssist under Travel or Finance. The system will escalate it immediately to the appropriate approver.,Finance
I strongly believe a serious policy violation is happening and I’m scared to speak up openly.,You can report policy violations confidentially through CogniAssist. HR or Compliance teams will review and act without exposing your identity.,Policy
My system access was suddenly revoked and no one told me why. This is extremely frustrating.,We apologize for the disruption. Please raise a High priority IT request through CogniAssist. IT and HR will review and clarify the access change.,IT
I am completely burnt out and stressed because of workload and nobody is listening.,We’re sorry you’re feeling this way. Please raise the concern through CogniAssist under HR. HR will guide you to available support resources.,HR
This keeps happening again and again. Nothing ever gets resolved properly here.,We regret your experience. Please submit a detailed issue through CogniAssist so it can be escalated and addressed appropriately.,General
