question,answers,category
What is the Introduction & Purpose policy at NovaEdge Technologies?,NovaEdge Technologies maintains the Introduction & Purpose policy. Employees are expected to follow outlined responsibilities and procedures. Requests must be submitted through CogniAssist and escalation matrices followed. HR or IT will respond within SLA timelines. For urgent matters,
What is the Leave Policy at NovaEdge Technologies?,The Leave Policy defines responsibilities and procedures for applying leave. Employees must submit requests through CogniAssist. HR will respond within SLA timelines. Urgent leave matters should be marked as High or Critical.,HR
What are the Hybrid Work Guidelines at NovaEdge Technologies?,Hybrid Work Guidelines describe procedures for remote and hybrid working. Requests and queries must be raised through CogniAssist and escalated if required. HR or IT will respond within SLA timelines.,HR
What is the Performance Review Policy at NovaEdge Technologies?,The Performance Review Policy outlines evaluation procedures,
What benefits and insurance policies are provided by NovaEdge Technologies?,The Benefits & Insurance policy explains employee benefits,
What is the Code of Conduct at NovaEdge Technologies?,The Code of Conduct defines expected employee behavior and organizational standards. Reporting and procedures must be followed via CogniAssist. HR or IT responds within SLA timelines.,Policy
What is the IT Security Policy at NovaEdge Technologies?,The IT Security Policy outlines security responsibilities,
How does NovaEdge Technologies handle Data Protection & Privacy?,The Data Protection & Privacy policy defines how personal and organizational data must be handled securely. Concerns and incidents must be submitted via CogniAssist. IT or HR responds within SLA timelines.,IT
What is the Asset Management policy at NovaEdge Technologies?,The Asset Management policy explains how company assets should be requested,
What is the Employee Onboarding process at NovaEdge Technologies?,The Employee Onboarding policy outlines procedures and responsibilities for new hires. All onboarding requests should be raised through CogniAssist. HR or IT responds within SLA timelines.,HR
What is the Offboarding Policy at NovaEdge Technologies?,The Offboarding Policy defines procedures when an employee exits the organization. Requests must be submitted via CogniAssist and escalated if required. HR or IT responds within SLA timelines.,HR
How does Expense Reimbursement work at NovaEdge Technologies?,The Expense Reimbursement policy explains how employees can submit reimbursement claims and required approvals. Requests should be submitted via CogniAssist. Finance or HR responds within SLA timelines.,Finance
What is the Travel Policy at NovaEdge Technologies?,The Travel Policy defines rules,
What is the Meeting & Travel Approval process at NovaEdge Technologies?,The Meeting & Travel Approval policy outlines approval workflows and escalation paths. Employees must submit requests through CogniAssist and follow defined guidelines.,Finance
What are the Workplace Safety guidelines at NovaEdge Technologies?,The Workplace Safety policy explains employee safety responsibilities,
What is the Equal Opportunity policy at NovaEdge Technologies?,The Equal Opportunity policy ensures fair treatment and non-discrimination in the workplace. Employees should submit concerns or grievances via CogniAssist. HR responds within SLA timelines.,HR
What are the Working Hours & Attendance rules at NovaEdge Technologies?,The Working Hours & Attendance policy outlines expected working hours,
How does Payroll & Compensation work at NovaEdge Technologies?,The Payroll & Compensation policy explains salary processing,
What Training & Development opportunities are available at NovaEdge Technologies?,The Training & Development policy outlines learning opportunities,
How does Feedback & Grievance handling work at NovaEdge Technologies?,The Feedback & Grievance policy explains how employees can raise concerns or feedback. Requests must be submitted through CogniAssist and escalated if required. HR responds within SLA timelines.,HR
What is NovaEdge Technologies and what should new employees know?,"Welcome to NovaEdge Technologies. NovaEdge is a technology-driven organization focused on operational excellence, innovation, and employee empowerment. This handbook provides practical guidance to help employees navigate daily tasks, policies, and common requests. For IT-related issues, employees should use the CogniAssist chat to automatically create tickets and receive guided resolution steps.",Company
What is the vision and mission of NovaEdge Technologies?,"NovaEdge Technologies’ vision is to deliver secure, scalable, and intelligent digital solutions while fostering a culture of accountability and continuous learning. The mission is to empower employees with clear processes, efficient tools, and transparent communication to support business and personal growth.",Company
How do new employees get started at NovaEdge Technologies?,"The Getting Started guide helps new employees understand essential tools, workflows, and internal processes. Employees are encouraged to review onboarding materials, access internal systems, and use CogniAssist for IT or HR-related assistance. Step-by-step instructions are provided to ensure a smooth transition.",HR
What does the IT & Security Guide cover at NovaEdge Technologies?,"The IT & Security Guide outlines best practices for system access, password management, data protection, and acceptable use of company resources. Employees must follow security protocols and report incidents using CogniAssist to ensure compliance and protect company data.",IT
How can employees use CogniAssist effectively?,"CogniAssist is NovaEdge Technologies’ internal support assistant used for IT, HR, and operational requests. Employees can use the chat interface to raise issues, automatically create support tickets, track progress, and receive step-by-step guidance for common tasks.",IT
How do employees set up VPN and remote work access?,"The VPN & Remote Work Setup guide explains how employees can securely access company systems from remote locations. Employees must follow setup instructions, comply with security policies, and use CogniAssist to request assistance or report access issues.",IT
How can employees request hardware at NovaEdge Technologies?,"Employees can request laptops, peripherals, and other hardware through approved procedures. Requests must be submitted via CogniAssist with required justifications. IT reviews requests and responds according to defined SLA timelines.",IT
Where can employees find payroll-related information?,"The Payroll FAQ provides answers to common questions about salary processing, payslips, deductions, and payment timelines. Employees should submit payroll queries through CogniAssist to ensure timely resolution by HR or Finance teams.",Finance
How are performance reviews and promotions handled at NovaEdge Technologies?,"The Performance & Promotions guide explains evaluation cycles, performance criteria, and promotion processes. Employees are encouraged to set goals, participate in reviews, and raise related queries via CogniAssist for clarity and escalation if required.",HR
How can employees contact support or get help at NovaEdge Technologies?,"The Contact & Support section provides guidance on how employees can seek assistance for IT, HR, Finance, or general concerns. CogniAssist is the primary channel for support requests, ticket tracking, and guided resolutions.",Company
How do I raise an IT support request at NovaEdge Technologies?,"Employees should use the CogniAssist chat to raise IT support requests. The system automatically creates a ticket, assigns priority, and routes it to the IT team. Employees can track progress and receive step-by-step resolution guidance through CogniAssist.",IT
What should I do if my system or application is not working?,"If a system or application issue occurs, employees must report it through CogniAssist with a clear description and screenshots if available. IT will respond based on SLA timelines and escalate critical issues if required.",IT
How do I reset my password or unlock my account?,Employees can request password resets or account unlocks using CogniAssist. Identity verification may be required before IT processes the request. Passwords must comply with company security standards.,IT
What is the standard process for requesting new hardware?,Employees must submit hardware requests such as laptops or accessories through CogniAssist. The request should include justification and approval details. IT evaluates availability and responds within defined SLA timelines.,IT
How do I report a cybersecurity incident or suspicious activity?,"Any suspected phishing, malware, or unauthorized access must be reported immediately through CogniAssist. Employees should avoid interacting with suspicious links or files until IT provides further instructions.",Security
What are the basic IT security best practices employees must follow?,"Employees must use strong passwords, avoid sharing credentials, lock devices when unattended, and follow data handling guidelines. Security awareness compliance is mandatory for all NovaEdge employees.",Security
How does NovaEdge protect employee and company data?,"NovaEdge follows strict Data Protection & Privacy policies. Data is secured using access controls, encryption, and monitoring. Employees must handle sensitive information responsibly and report violations via CogniAssist.",Security
What should I do if I lose my laptop or company device?,"In case of lost or stolen devices, employees must immediately inform IT via CogniAssist. IT will take steps to secure company data and initiate asset recovery or replacement procedures.",Security
How do I apply for leave at NovaEdge Technologies?,Employees should submit leave requests through the designated HR system or CogniAssist. Requests must be approved by the reporting manager. HR processes requests according to company leave policies.,HR
Whom should I contact for HR-related questions or concerns?,"All HR-related queries including leave, benefits, and policies should be raised through CogniAssist. HR will respond within SLA timelines and escalate sensitive matters if required.",HR
How does payroll processing work at NovaEdge Technologies?,"Payroll is processed as per defined schedules. Payslips, deductions, and salary-related queries can be accessed or raised through CogniAssist. Finance or HR will respond within SLA timelines.",Finance
What is the process for expense reimbursement?,Employees must submit expense reimbursement requests with supporting documents through CogniAssist. Finance reviews submissions and processes approved claims as per company policy.,Finance
How are performance reviews conducted at NovaEdge Technologies?,Performance reviews are conducted periodically based on defined evaluation criteria. Employees should participate in review cycles and raise performance-related queries via CogniAssist if clarification is required.,HR
How do promotions work at NovaEdge Technologies?,"Promotions are based on performance, role requirements, and business needs. Employees can seek guidance or clarification through CogniAssist during review or promotion cycles.",HR
What is the company policy on remote or hybrid work?,"NovaEdge supports approved hybrid and remote work models. Employees must follow defined guidelines, security requirements, and approval workflows. Queries should be raised via CogniAssist.",HR
How do I access company systems while working remotely?,Remote access requires VPN configuration and compliance with security policies. Employees should follow setup instructions and request assistance through CogniAssist if needed.,IT
What should I do if I receive a suspicious email?,Employees should not click on suspicious links or attachments. Such emails must be reported immediately through CogniAssist for security analysis and action.,Security
How does NovaEdge handle employee grievances or feedback?,Employees can raise grievances or feedback confidentially through CogniAssist. HR reviews submissions and ensures fair resolution following company guidelines.,HR
Where can I find company policies and guidelines?,"All company policies including HR, IT, and Security guidelines are available through internal documentation and CogniAssist. Employees are encouraged to review them regularly.",Company
Who should I contact in case of urgent issues?,"For urgent or critical matters, employees should mark priority as High or Critical in CogniAssist. The system ensures faster escalation to the appropriate team.",Company
